[
  {
    "policy_number": "SC00928274",
    "effective_date": "04/23/19",
    "claim_reported": "X",
    "claim_number": "00928274-10000",
    "claimant": "Fairmont Cold Storage",
    "date_reported": "05/14/19",
    "date_of_loss": "05/13/19",
    "claim_status": "Pending",
    "date_closed": "",
    "adjuster": "Jordan U. Hollis",
    "claim_reserves": 1200.86,
    "claim_paid": 0.0,
    "claim_recovered": 0.0,
    "description": "roll-up door damage noted during post-trip inspection; rental and downtime amounts were still being reconciled; salvage credit had not posted to the run",
    "driver": ""
  },
  {
    "policy_number": "SC00928274",
    "effective_date": "04/23/19",
    "claim_reported": "X",
    "claim_number": "00928274-10001",
    "claimant": "Bayline Warehouse",
    "date_reported": "05/26/19",
    "date_of_loss": "05/20/19",
    "claim_status": "Reopened",
    "date_closed": "",
    "adjuster": "Zion P. Larkin",
    "claim_reserves": 5329.23,
    "claim_paid": 339.35,
    "claim_recovered": 0.0,
    "description": "trailer door contacted by loading equipment",
    "driver": "Rowan X. Foster"
  },
  {
    "policy_number": "SC00928274",
    "effective_date": "04/23/19",
    "claim_reported": "X",
    "claim_number": "00928274-10002",
    "claimant": "Grove Street Produce",
    "date_reported": "06/07/19",
    "date_of_loss": "05/27/19",
    "claim_status": "Closed",
    "date_closed": "08/08/19",
    "adjuster": "Morgan T. Ivers",
    "claim_reserves": 0.0,
    "claim_paid": 6424.71,
    "claim_recovered": 0.0,
    "description": "claim opened from late-submitted repair documentation",
    "driver": "Dakota F. Serrano"
  },
  {
    "policy_number": "SC00928274",
    "effective_date": "04/23/19",
    "claim_reported": "X",
    "claim_number": "00928274-10003",
    "claimant": "Alder Logistics Repair",
    "date_reported": "06/19/19",
    "date_of_loss": "06/03/19",
    "claim_status": "Open",
    "date_closed": "",
    "adjuster": "Taylor D. Ramos",
    "claim_reserves": 13587.04,
    "claim_paid": 462.75,
    "claim_recovered": 0.0,
    "description": "claim opened from late-submitted repair documentation",
    "driver": "Casey Y. Keller"
  },
  {
    "policy_number": "SC00928274",
    "effective_date": "04/23/19",
    "claim_reported": "X",
    "claim_number": "00928274-10004",
    "claimant": "Harbor Medical Supply",
    "date_reported": "07/01/19",
    "date_of_loss": "06/10/19",
    "claim_status": "Pending",
    "date_closed": "",
    "adjuster": "Morgan H. Mercer",
    "claim_reserves": 17716.98,
    "claim_paid": 1357.4,
    "claim_recovered": 0.0,
    "description": "windshield and cowl damage attributed to road debris",
    "driver": ""
  },
  {
    "policy_number": "SC00928274",
    "effective_date": "04/23/19",
    "claim_reported": "X",
    "claim_number": "00928274-10005",
    "claimant": "Lakeview Auto Glass",
    "date_reported": "07/13/19",
    "date_of_loss": "06/17/19",
    "claim_status": "Closed",
    "date_closed": "10/16/19",
    "adjuster": "Zion R. Benton",
    "claim_reserves": 0.0,
    "claim_paid": 14935.01,
    "claim_recovered": 302.0,
    "description": "steer tire failure led to roadside service invoice",
    "driver": "Parker G. Gaines"
  },
  {
    "policy_number": "SC00928274",
    "effective_date": "04/23/19",
    "claim_reported": "X",
    "claim_number": "00928274-10006",
    "claimant": "Tamarack Freight",
    "date_reported": "07/25/19",
    "date_of_loss": "06/24/19",
    "claim_status": "Closed",
    "date_closed": "11/08/19",
    "adjuster": "Morgan M. Hollis",
    "claim_reserves": 0.0,
    "claim_paid": 17772.54,
    "claim_recovered": 0.0,
    "description": "cargo shortage noticed after consignee inspection",
    "driver": "Kai U. Gaines"
  },
  {
    "policy_number": "SC00928274",
    "effective_date": "04/23/19",
    "claim_reported": "X",
    "claim_number": "00928274-10007",
    "claimant": "Alder Logistics Repair",
    "date_reported": "08/06/19",
    "date_of_loss": "07/01/19",
    "claim_status": "Reopened",
    "date_closed": "",
    "adjuster": "Avery Z. Larkin",
    "claim_reserves": 30103.24,
    "claim_paid": 2375.45,
    "claim_recovered": 0.0,
    "description": "roll-up door damage noted during post-trip inspection; supplemental invoice was requested from the vendor",
    "driver": "Emery K. Ellis"
  },
  {
    "policy_number": "SC00928276",
    "effective_date": "04/22/21",
    "claim_reported": "X",
    "claim_number": "00928276-10008",
    "claimant": "Canyon Fleet Body",
    "date_reported": "08/17/21",
    "date_of_loss": "07/07/21",
    "claim_status": "Open",
    "date_closed": "",
    "adjuster": "Sawyer F. Voss",
    "claim_reserves": 34232.1,
    "claim_paid": 1234.0,
    "claim_recovered": 0.0,
    "description": "reefer unit service call included in repair estimate",
    "driver": ""
  },
  {
    "policy_number": "SC00928276",
    "effective_date": "04/22/21",
    "claim_reported": "X",
    "claim_number": "00928276-10009",
    "claimant": "East Ridge Collision",
    "date_reported": "07/18/21",
    "date_of_loss": "07/14/21",
    "claim_status": "Pending",
    "date_closed": "",
    "adjuster": "Taylor J. Nolan",
    "claim_reserves": 38361.07,
    "claim_paid": 3054.15,
    "claim_recovered": 0.0,
    "description": "forklift contact with parked trailer during unloading",
    "driver": "Harper O. Carver"
  },
  {
    "policy_number": "SC00928276",
    "effective_date": "04/22/21",
    "claim_reported": "X",
    "claim_number": "00928276-10010",
    "claimant": "Bayline Warehouse",
    "date_reported": "07/30/21",
    "date_of_loss": "07/21/21",
    "claim_status": "Closed",
    "date_closed": "12/27/21",
    "adjuster": "Dakota I. Priest",
    "claim_reserves": 0.0,
    "claim_paid": 29120.21,
    "claim_recovered": 604.0,
    "description": "fuel-island scrape reported during yard maneuver",
    "driver": "Rowan R. Hollis"
  },
  {
    "policy_number": "SC00928276",
    "effective_date": "04/22/21",
    "claim_reported": "X",
    "claim_number": "00928276-10011",
    "claimant": "Dover Equipment Rental",
    "date_reported": "08/11/21",
    "date_of_loss": "07/28/21",
    "claim_status": "Reopened",
    "date_closed": "",
    "adjuster": "Kai L. Priest",
    "claim_reserves": 46619.11,
    "claim_paid": 3732.85,
    "claim_recovered": 0.0,
    "description": "subrogation file opened for possible third-party recovery; medical reserve was reviewed without closing the file",
    "driver": "Taylor U. Larkin"
  },
  {
    "policy_number": "SC00928276",
    "effective_date": "04/22/21",
    "claim_reported": "X",
    "claim_number": "00928276-10012",
    "claimant": "Keystone Materials",
    "date_reported": "08/23/21",
    "date_of_loss": "08/04/21",
    "claim_status": "Closed",
    "date_closed": "02/11/22",
    "adjuster": "Rowan F. Keller",
    "claim_reserves": 0.0,
    "claim_paid": 34794.97,
    "claim_recovered": 0.0,
    "description": "towing and storage reimbursement requested after disablement",
    "driver": ""
  },
  {
    "policy_number": "SC00928277",
    "effective_date": "04/22/22",
    "claim_reported": "X",
    "claim_number": "00928277-10013",
    "claimant": "Tamarack Freight",
    "date_reported": "09/04/22",
    "date_of_loss": "08/11/22",
    "claim_status": "Pending",
    "date_closed": "",
    "adjuster": "Avery B. Quint",
    "claim_reserves": 54877.2,
    "claim_paid": 4411.55,
    "claim_recovered": 0.0,
    "description": "claim opened from late-submitted repair documentation",
    "driver": "Avery C. Serrano"
  },
  {
    "policy_number": "SC00928277",
    "effective_date": "04/22/22",
    "claim_reported": "X",
    "claim_number": "00928277-10014",
    "claimant": "Keystone Materials",
    "date_reported": "09/16/22",
    "date_of_loss": "08/18/22",
    "claim_status": "Pending",
    "date_closed": "",
    "adjuster": "Winter J. Larkin",
    "claim_reserves": 59006.58,
    "claim_paid": 4750.9,
    "claim_recovered": 0.0,
    "description": "windshield and cowl damage attributed to road debris; salvage credit had not posted to the run",
    "driver": "Vaughn Z. Carver"
  },
  {
    "policy_number": "SC00928277",
    "effective_date": "04/22/22",
    "claim_reported": "X",
    "claim_number": "00928277-10015",
    "claimant": "Quarry Road Terminal",
    "date_reported": "09/28/22",
    "date_of_loss": "08/25/22",
    "claim_status": "Open",
    "date_closed": "",
    "adjuster": "Morgan I. Priest",
    "claim_reserves": 63135.93,
    "claim_paid": 2313.75,
    "claim_recovered": 906.0,
    "description": "parked tractor struck during overnight staging",
    "driver": "Blake S. Carver"
  },
  {
    "policy_number": "SC00928277",
    "effective_date": "04/22/22",
    "claim_reported": "X",
    "claim_number": "00928277-10016",
    "claimant": "East Ridge Collision",
    "date_reported": "10/10/22",
    "date_of_loss": "09/01/22",
    "claim_status": "Pending",
    "date_closed": "",
    "adjuster": "Rowan A. Foster",
    "claim_reserves": 67264.34,
    "claim_paid": 5429.6,
    "claim_recovered": 0.0,
    "description": "claim opened from late-submitted repair documentation",
    "driver": ""
  },
  {
    "policy_number": "SC00928277",
    "effective_date": "04/22/22",
    "claim_reported": "X",
    "claim_number": "00928277-10017",
    "claimant": "Oak Valley Repair",
    "date_reported": "09/10/22",
    "date_of_loss": "09/08/22",
    "claim_status": "Pending",
    "date_closed": "",
    "adjuster": "Avery O. Priest",
    "claim_reserves": 71393.76,
    "claim_paid": 5768.95,
    "claim_recovered": 0.0,
    "description": "parked tractor struck during overnight staging",
    "driver": "Reese K. Aldridge"
  },
  {
    "policy_number": "SC00928277",
    "effective_date": "04/22/22",
    "claim_reported": "X",
    "claim_number": "00928277-10018",
    "claimant": "Canyon Fleet Body",
    "date_reported": "09/22/22",
    "date_of_loss": "09/15/22",
    "claim_status": "Open",